{
  "version": "2",
  "endpoint": "https://pairing.example.test/v1/pairing/complete",
  "intent_id": "YGFiY2RlZmdoaWprbG1ubw",
  "intent_nonce": "sLGys7S1tre4ubq7vL2-v8DBwsPExcbHyMnKy8zNzs8",
  "expires_at": "2026-09-01T12:00:00Z",
  "algorithms": "X25519-crypto_kx-XChaCha20-Poly1305-IETF",
  "enrollment_signing_fingerprint": "gF0vfOTYfcKmnOVpHQRkUe_y1VPmSLhXDydcnkVEvjc",
  "enrollment_signing_public_key": "bw8O6z-_-SXGbQPhnc5I1e3J_-5RzSaucd055W9_3aI",
  "server_key_agreement_public_key": "DgIWIj8UcUPTJhWpEYnCiMFyjLo8xfn2IbECbgPYMSk",
  "pairing_secret": "QEFCQ0RFRkdISUpLTE1OT1BRUlNUVVZXWFlaW1xdXl8",
  "trust_mode": "pinned_continuity",
  "signature": "v4RXXml4R8bpzzJVflH6W29SQ4OVcjM2TmSlBgy-1nzCqBQ-ivUOjhATZhAgxTpXpiQ09ySmlCmoDZDzadOiAA"
}
